{
  "$schema": "https://json-schema.org/draft/2020-12/schema",
  "$id": "https://lauren.app/schema/library-item/0.1.json",
  "title": "Lauren Library Item",
  "description": "Manifest for one effect, transition, animation or speed ramp preset. The AI receives a catalog built from these manifests and picks items by id; nothing about individual items is hardcoded in the edit plan schema or the app.",
  "type": "object",
  "additionalProperties": false,
  "required": [
    "id",
    "kind",
    "name",
    "description",
    "params_schema"
  ],
  "properties": {
    "id": {
      "type": "string",
      "pattern": "^[a-z][a-z0-9_-]{0,63}$"
    },
    "kind": {
      "enum": [
        "effect",
        "transition",
        "animation",
        "ramp"
      ]
    },
    "version": {
      "type": "string",
      "default": "1.0.0"
    },
    "name": {
      "type": "string",
      "description": "Display name in the UI."
    },
    "description": {
      "type": "string",
      "description": "What it looks like and when to use it. Written for the AI: this is how it chooses."
    },
    "tags": {
      "type": "array",
      "items": {
        "type": "string"
      },
      "description": "Mood and style hints, e.g. energetic, smooth, comedic, cinematic."
    },
    "duration": {
      "type": "object",
      "additionalProperties": false,
      "required": [
        "default"
      ],
      "properties": {
        "default": {
          "type": "number",
          "minimum": 0
        },
        "min": {
          "type": "number",
          "minimum": 0
        },
        "max": {
          "type": "number",
          "minimum": 0
        }
      }
    },
    "overlap": {
      "type": "boolean",
      "default": false,
      "description": "Transitions only. true: both clips are visible at once, so they overlap by the duration and the timeline gets shorter. false: applied to the end of the previous clip and the start of the next, timeline length unchanged."
    },
    "params_schema": {
      "type": "object",
      "description": "JSON Schema (type object) for the item's parameters. Every parameter needs a default and a description so the AI can use it."
    },
    "render": {
      "type": "object",
      "description": "How the engine draws the item. Format not decided yet (see docs/LIBRARY.md)."
    },
    "slots": {
      "type": "array",
      "items": {
        "enum": [
          "in",
          "out",
          "loop"
        ]
      },
      "minItems": 1,
      "uniqueItems": true,
      "default": [
        "in",
        "out"
      ],
      "description": "Animations only: which overlay slots the item can fill. 'in' plays as written; 'out' plays it in reverse; 'loop' repeats while the overlay is visible, with 'duration' as one cycle."
    },
    "points": {
      "type": "array",
      "minItems": 2,
      "description": "Ramps only: the speed ramp this preset expands to. Offsets are source seconds relative to the moment the preset is placed at. 'offset' and 'speed' are numbers or arithmetic expressions over the preset's parameters (e.g. \"-(before + ease)\").",
      "items": {
        "type": "object",
        "additionalProperties": false,
        "required": [
          "offset",
          "speed"
        ],
        "properties": {
          "offset": {
            "type": [
              "number",
              "string"
            ]
          },
          "speed": {
            "type": [
              "number",
              "string"
            ]
          },
          "easing": {
            "enum": [
              "linear",
              "smooth",
              "hold"
            ],
            "default": "smooth"
          }
        }
      }
    }
  },
  "allOf": [
    {
      "if": {
        "properties": {
          "kind": {
            "const": "ramp"
          }
        }
      },
      "then": {
        "required": [
          "points"
        ]
      },
      "else": {
        "not": {
          "required": [
            "points"
          ]
        }
      }
    }
  ]
}
