{
  "id": "strobe",
  "kind": "effect",
  "name": "Strobe",
  "description": "Rapid on/off flashing of brightness. Raw club energy; use only briefly. Capped at 3 flashes per second for photosensitive viewers.",
  "tags": [
    "music",
    "wild"
  ],
  "duration": {
    "default": 0.6,
    "min": 0.1,
    "max": 3
  },
  "params_schema": {
    "type": "object",
    "additionalProperties": false,
    "properties": {
      "frequency": {
        "type": "number",
        "minimum": 1,
        "maximum": 3,
        "default": 3,
        "description": "Flashes per second (at most 3, for viewer safety)."
      },
      "intensity": {
        "type": "number",
        "minimum": 0,
        "maximum": 1,
        "default": 0.7,
        "description": "Strength of the effect."
      }
    }
  }
}
